A-3: Weeks | C-3: ".substr($minggu[$i],-2,2)." | D-3: ".substr($minggu[$i],-2,2)."
A-2: D
A-1: C
A0: D & C | B0: Total
A1: D & C | B1: Cgk
A2: Revenue T/O
A3: Revenue F/H
A4: Dispatch Rel. | C4: ".$DR[$i]." | D4: 0) ? round(($TORevweek - $dc[11])/$TORevweek * 100,2) : 0?>
C7: =C1 -> 52 | D7: =D1 -> 1 | E7: =E1 -> 2 | F7: =F1 -> 3 | G7: =G1 -> 4 | H7: =H1 -> 5 | I7: =I1 -> 6 | J7: =J1 -> 7 | K7: =K1 -> 8 | L7: =L1 -> 9 | M7: =M1 -> 10 | N7: =N1 -> 11
B8: Dispatch Rel. | C8: =C8 -> 96.566523605150209 | D8: =D8 -> 100.00 | E8: =E8 -> 100.00 | F8: =F8 -> 100.00 | G8: =G8 -> 100.00 | H8: =H8 -> 100.00 | I8: =I8 -> 100.00 | J8: =J8 -> 100.00 | K8: =K8 -> 98.275126144363043 | L8: =L8 -> 100.00 | M8: =M8 -> 98.276465140584293 | N8: =N8 -> 98.275795624235698
B9: Target | C9: 99.10 | D9: 99.10 | E9: 99.10 | F9: 99.10 | G9: 99.10 | H9: 99.10 | I9: 99.10 | J9: 99.10 | K9: 99.10 | L9: 99.10 | M9: 99.10 | N9: 99.10
B10: D & C Rate | C10: =(C4/C6)*100 -> 3.4334763948497855 | D10: =(D4/D6)*100 -> 0.00 | E10: =(E4/E6)*100 -> 0.00 | F10: =(F4/F6)*100 -> 0.00 | G10: =(G4/G6)*100 -> 0.00 | H10: =(H4/H6)*100 -> 0.00 | I10: =(I4/I6)*100 -> 0.00 | J10: =(J4/J6)*100 -> 0.00 | K10: =(K4/K6)*100 -> 1.7248738556369596 | L10: =(L4/L6)*100 -> 0.00 | M10: =(M4/M6)*100 -> 1.7235348594157107 | N10: =(N4/N6)*100 -> 1.7242043757643031