I1: Week 19 / 5 May - 11 May 2008
A7: Technical delays> 15 Min. | E7: =":" & "  "&RIGHT("0"&N41,2) -> : 04 | I7: Dispatch reliability | L7: : | M7: =N51 -> 99.307958477508649 | N7: %
A8: Technical cancellation | E8: =":" & "  "&RIGHT("0"&N42,2) -> : 00 | I8: Target | L8: : | M8: =N52 -> 99.10 | N8: %
A9: Technical incident | E9: : 00
A12: Technical Delay Analysis
A13: Significant Event
B15: Event | C15: Problem | F15: Cause | I15: Corrective Action
A40: Weeks | C40: 8 | D40: 9 | E40: 10 | F40: 11 | G40: 12 | H40: 13 | I40: 14 | J40: 15 | K40: 16 | L40: 17 | M40: 18 | N40: 19
A41: D | C41: 0 | D41: 1 | E41: 1 | F41: 3 | G41: 5 | H41: 2 | I41: 3 | J41: 4 | K41: 11 | L41: 7 | M41: 4 | N41: 4
A42: C | C42: 0 | D42: 0 | E42: 0 | F42: 0 | G42: 0 | H42: 0 | I42: 0 | J42: 0 | K42: 0 | L42: 0 | M42: 0 | N42: 0
A43: D & C | B43: Total | C43: 0 | D43: 1 | E43: 1 | F43: 3 | G43: 5 | H43: 2 | I43: 3 | J43: 4 | K43: 11 | L43: 7 | M43: 4 | N43: 4
A44: D & C | B44: Cgk | C44: 0 | D44: 1 | E44: 0 | F44: 2 | G44: 5 | H44: 2 | I44: 3 | J44: 3 | K44: 9 | L44: 6 | M44: 3 | N44: 2
A45: Revenue T/O | C45: 449 | D45: 426 | E45: 450 | F45: 447 | G45: 517 | H45: 548 | I45: 563 | J45: 603 | K45: 572 | L45: 574 | M45: 562 | N45: 578
A46: Revenue F/H | C46: 641 | D46: 602 | E46: 622 | F46: 629 | G46: 716 | H46: 756 | I46: 704 | J46: 773 | K46: 742 | L46: 737 | M46: 731 | N46: 746
A47: Dispatch Rel. | C47: =(C45-C43)/C45*100 -> 100.00 | D47: =(D45-D43)/D45*100 -> 99.765258215962433 | E47: =(E45-E43)/E45*100 -> 99.777777777777771 | F47: =(F45-F43)/F45*100 -> 99.328859060402692 | G47: =(G45-G43)/G45*100 -> 99.032882011605423 | H47: =(H45-H43)/H45*100 -> 99.635036496350367 | I47: =(I45-I43)/I45*100 -> 99.46714031971581 | J47: =(J45-J43)/J45*100 -> 99.336650082918737 | K47: =(K45-K43)/K45*100 -> 98.076923076923066 | L47: =(L45-L43)/L45*100 -> 98.780487804878049 | M47: =(M45-M43)/M45*100 -> 99.288256227758012 | N47: =(N45-N43)/N45*100 -> 99.307958477508649
C50: =C40 -> 8 | D50: =D40 -> 9 | E50: =E40 -> 10 | F50: =F40 -> 11 | G50: =G40 -> 12 | H50: =H40 -> 13 | I50: =I40 -> 14 | J50: =J40 -> 15 | K50: =K40 -> 16 | L50: =L40 -> 17 | M50: =M40 -> 18 | N50: =N40 -> 19
B51: Dispatch Rel. | C51: =C47 -> 100.00 | D51: =D47 -> 99.765258215962433 | E51: =E47 -> 99.777777777777771 | F51: =F47 -> 99.328859060402692 | G51: =G47 -> 99.032882011605423 | H51: =H47 -> 99.635036496350367 | I51: =I47 -> 99.46714031971581 | J51: =J47 -> 99.336650082918737 | K51: =K47 -> 98.076923076923066 | L51: =L47 -> 98.780487804878049 | M51: =M47 -> 99.288256227758012 | N51: =N47 -> 99.307958477508649
B52: Target | C52: 99.10 | D52: 99.10 | E52: 99.10 | F52: 99.10 | G52: 99.10 | H52: 99.10 | I52: 99.10 | J52: 99.10 | K52: 99.10 | L52: 99.10 | M52: 99.10 | N52: 99.10
B53: D & C Rate | C53: =(C43/C45)*100 -> 0.00 | D53: =(D43/D45)*100 -> 0.23474178403755869 | E53: =(E43/E45)*100 -> 0.22222222222222221 | F53: =(F43/F45)*100 -> 0.67114093959731547 | G53: =(G43/G45)*100 -> 0.96711798839458418 | H53: =(H43/H45)*100 -> 0.36496350364963503 | I53: =(I43/I45)*100 -> 0.53285968028419184 | J53: =(J43/J45)*100 -> 0.66334991708126034 | K53: =(K43/K45)*100 -> 1.9230769230769231 | L53: =(L43/L45)*100 -> 1.2195121951219512 | M53: =(M43/M45)*100 -> 0.71174377224199281 | N53: =(N43/N45)*100 -> 0.69204152249134954

A1: Reg