A-1: ENGINE OPERATION SUMMARY -
D1: -
A3: NUMBER OF ENGINES IN FLEET
A5: HOURS-CUMMULATIVE
A6: HOURS-OPERATED | C6: 0
A8: CYCLES-CUMMULATIVE
A9: CYCLES-OPERATED
A11: IN-FLIGHT SHUTDOWN
B12: - RATE
B13: - 3 MO. RATE
A15: ABORTED TAKE-OFF
B16: - RATE
B17: - 3 MO. RATE
A19: CONVENIENCE
A20: CAMPAIGN
A21: REFURBISHMENT | B21: PREDIFINE REMOVAL
B22: * BASIC - PLANNED
B23: - UNPLANNED
B24: * NON BASIC - PLANNED
B25: - UNPLANNED
B26: PREMATURE REMOVAL
B27: * BASIC - PLANNED
B28: - UNPLANNED
B29: * NON BASIC - PLANNED
B30: - UNPLANNED
A32: TOTAL UNPLANNED ENGINE REMOVALS
B33: - UER RATE
B34: - 3 MO. RATE
B35: - 12 MO. RATE
A37: TOTAL PREMATURE REMOVALS
B38: - RATE
B39: - 3 MO. RATE
B40: - 12 MO. RATE
A42: TOTAL SHOP VISITS
B43: - RATE
B44: - 3 MO. RATE
R45: 2006 s/d 2007 | S45: JAN | T45: FEB | U45: MAR | V45: APR | W45: MAY | X45: JUN | Y45: JUL | Z45: AUG | AA45: SEP | AB45: OCT | AC45: NOV | AD45: DEC | AE45: JAN | AF45: FEB | AG45: MAR | AH45: APR | AI45: MAY | AJ45: JUN | AK45: JUL | AL45: AUG | AM45: SEP | AN45: OCT | AO45: NOV | AP45: DEC | AQ45: JAN | AR45: FEB | AS45: MAR
A46: TOTAL ENGINE REMOVALS | G46: Operate | H46: 10430 | I46: 7788 | J46: 8736 | K46: 8444 | L46: 8168 | M46: 7784 | N46: 8958 | O46: 9230 | P46: 9034 | Q46: 8658 | R46: 8796 | S46: 9940 | T46: 10076 | U46: 8144 | V46: 8852 | W46: 9082 | X46: 10112 | Y46: 9770 | Z46: 11310 | AA46: 10902 | AB46: 9614 | AC46: 10218 | AD46: 9490 | AE46: 10480 | AF46: 10582 | AG46: 9572 | AH46: =5065*2 -> 10130
B47: - RATE/1000 ENG.HOURS | G47: Total IFSD | H47: 0 | I47: 0 | J47: 0 | K47: 0 | L47: 0 | M47: 0 | N47: 0 | O47: 0 | P47: 0 | Q47: 0 | R47: 0 | S47: 0 | T47: 0 | U47: 0 | V47: 0 | W47: 0 | X47: 0 | Y47: 0 | Z47: 0 | AA47: 0 | AB47: 0 | AC47: 0 | AD47: 0 | AE47: 1 | AF47: 0 | AG47: 0 | AH47: 0
B48: - 12 MO. RATE | G48: Rate | U48: =(SUM(U47:AF47)*1000/(SUM(U46:AF46))) -> 0.000 | V48: =(SUM(V47:AG47)*1000/(SUM(V46:AG46))) -> 0.000 | W48: =(SUM(W47:AH47)*1000/(SUM(W46:AH46))) -> 0.000 | X48: =(SUM(X47:AI47)*1000/(SUM(X46:AI46))) -> 0.000 | Y48: =(SUM(Y47:AJ47)*1000/(SUM(Y46:AJ46))) -> 0.000 | Z48: =(SUM(Z47:AK47)*1000/(SUM(Z46:AK46))) -> 0.000 | AA48: =(SUM(AA47:AL47)*1000/(SUM(AA46:AL46))) -> 0.000 | AB48: =(SUM(AB47:AM47)*1000/(SUM(AB46:AM46))) -> 0.000 | AC48: =(SUM(AC47:AN47)*1000/(SUM(AC46:AN46))) -> 0.000 | AD48: =(SUM(AD47:AO47)*1000/(SUM(AD46:AO46))) -> 0.000 | AE48: =(SUM(AE47:AP47)*1000/(SUM(AE46:AP46))) -> 0.008 | AF48: =(SUM(AF47:AQ47)*1000/(SUM(AF46:AQ46))) -> 0.008 | AG48: =(SUM(AG47:AR47)*1000/(SUM(AG46:AR46))) -> 0.008 | AH48: =(SUM(AH47:AS47)*1000/(SUM(AH46:AS46))) -> 0.008
O49: Page : 7 | R49: Rate 3 Month | AH49: =(AF48+AG48+AH48)/3 -> 0.000 | AI49: =(AG48+AH48+AI48)/3 -> 0.000 | AJ49: =(AH48+AI48+AJ48)/3 -> 0.000 | AK49: =(AI48+AJ48+AK48)/3 -> 0.000 | AL49: =(AJ48+AK48+AL48)/3 -> 0.000 | AM49: =(AK48+AL48+AM48)/3 -> 0.000 | AN49: =(AL48+AM48+AN48)/3 -> 0.000 | AO49: =(AM48+AN48+AO48)/3 -> 0.000 | AP49: =(AN48+AO48+AP48)/3 -> 0.003 | AQ49: =(AO48+AP48+AQ48)/3 -> 0.006 | AR49: =(AP48+AQ48+AR48)/3 -> 0.008 | AS49: =(AQ48+AR48+AS48)/3 -> 0.008
R50: Total Removal | S50: 2 | T50: 9 | U50: 2 | V50: 0 | W50: 1 | X50: 1 | Y50: 2 | Z50: 2 | AA50: 7 | AB50: 3 | AC50: 8 | AD50: 3 | AE50: 2 | AF50: 2 | AG50: 5 | AH50: 1 | AI50: 2 | AJ50: 5 | AK50: 2 | AL50: 0 | AM50: 1 | AN50: 2 | AO50: 2 | AP50: 3 | AQ50: 1 | AR50: 2 | AS50: 2
R51: Rate | AF51: =(AF50*1000)/(AF46) -> 0.246 | AG51: =(AG50*1000)/(AG46) -> 0.565 | AH51: =(AH50*1000)/(AH46) -> 0.110 | AI51: =(AI50*1000)/(AI46) -> 0.198 | AJ51: =(AJ50*1000)/(AJ46) -> 0.512 | AK51: =(AK50*1000)/(AK46) -> 0.177 | AL51: =(AL50*1000)/(AL46) -> 0.000 | AM51: =(AM50*1000)/(AM46) -> 0.104 | AN51: =(AN50*1000)/(AN46) -> 0.196 | AO51: =(AO50*1000)/(AO46) -> 0.211 | AP51: =(AP50*1000)/(AP46) -> 0.286 | AQ51: =(AQ50*1000)/(AQ46) -> 0.095 | AR51: =(AR50*1000)/(AR46) -> 0.209 | AS51: =(AS50*1000)/(AS46) -> 0.197
R52: Rate 12 Month | AH52: =(W51+X51+Y51+Z51+AA51+AB51+AC51+AD51+AE51+AF51+AG51+AH51)/12 -> 0.077 | AI52: =(X51+Y51+Z51+AA51+AB51+AC51+AD51+AE51+AF51+AG51+AH51+AI51)/12 -> 0.093 | AJ52: =(Y51+Z51+AA51+AB51+AC51+AD51+AE51+AF51+AG51+AH51+AI51+AJ51)/12 -> 0.136 | AK52: =(Z51+AA51+AB51+AC51+AD51+AE51+AF51+AG51+AH51+AI51+AJ51+AK51)/12 -> 0.151 | AL52: =(AA51+AB51+AC51+AD51+AE51+AF51+AG51+AH51+AI51+AJ51+AK51+AL51)/12 -> 0.151 | AM52: =(AB51+AC51+AD51+AE51+AF51+AG51+AH51+AI51+AJ51+AK51+AL51+AM51)/12 -> 0.159 | AN52: =(AC51+AD51+AE51+AF51+AG51+AH51+AI51+AJ51+AK51+AL51+AM51+AN51)/12 -> 0.176 | AO52: =(AD51+AE51+AF51+AG51+AH51+AI51+AJ51+AK51+AL51+AM51+AN51+AO51)/12 -> 0.193 | AP52: =(AE51+AF51+AG51+AH51+AI51+AJ51+AK51+AL51+AM51+AN51+AO51+AP51)/12 -> 0.217 | AQ52: =(AF51+AG51+AH51+AI51+AJ51+AK51+AL51+AM51+AN51+AO51+AP51+AQ51)/12 -> 0.225 | AR52: =(AG51+AH51+AI51+AJ51+AK51+AL51+AM51+AN51+AO51+AP51+AQ51+AR51)/12 -> 0.222 | AS52: =(AH51+AI51+AJ51+AK51+AL51+AM51+AN51+AO51+AP51+AQ51+AR51+AS51)/12 -> 0.191
O98: Page : C8